{
  "schemaVersion": "1.0.0",
  "manifestVersion": "1.0.0",
  "auditedAt": "2026-09-30",
  "source": {
    "repository": "https://github.com/itdojp/white-hat-cyber-intelligence-book",
    "registrationIssue": 63,
    "contractIssue": 98,
    "registrationIssueSnapshotUpdatedAt": "2026-08-25T02:03:30Z",
    "contractIssueSnapshotUpdatedAt": "2026-09-05T08:37:42Z",
    "scope": "Issue #63に登録された非正本draft/blueprint Package。Codex Goal Packageは実装指示でありcandidate sourceではないため対象外。"
  },
  "externalAuditArtifact": {
    "availability": "not-present-in-authorized-workspace",
    "package": "white-hat-book-editorial-input-portfolio-2026-08-10.zip",
    "packageSha256": "b15e22286886bc558be8f286b3b13c6484e4b022eb414410baf482631a06c0f9",
    "manifest": "editorial-input-portfolio-manifest-2026-08-10.json",
    "manifestSha256": "6b2e3edc732ae6d24a69ed009ab1a72c456aff2f4d332692db9c71ee79877e03",
    "audit": "editorial-input-portfolio-audit-2026-08-10.md",
    "auditSha256": "06673f558d9fdf850ac8555c5e051a9f142cf9c21c0790a9a8bc87e3ae3b34a4",
    "goal": "editorial-input-manifest-contract-goal.md",
    "goalSha256": "44bfa5a9ecbb5950204d417c904d1cc786fee738c252d98762b4077a385b69f6",
    "provenanceUrl": "https://github.com/itdojp/white-hat-cyber-intelligence-book/issues/63#issuecomment-5239880003",
    "note": "外部Artifactの内容を推測再構成せず、live Issue #63/#98登録を照合元とした。"
  },
  "collisionAcknowledgements": [
    {
      "collisionId": "EICOLL-0001",
      "kind": "filename",
      "value": "white-hat-book-parallel-drafts-2026-08-09-wave5.zip",
      "packageIds": [
        "EIP-0005",
        "EIP-0006"
      ],
      "evidenceUrl": "https://github.com/itdojp/white-hat-cyber-intelligence-book/issues/98",
      "reason": "同名だがSHA-256とTargetが異なる歴史的Package。filenameで選択しない。"
    },
    {
      "collisionId": "EICOLL-0002",
      "kind": "wave-label",
      "value": "wave-5",
      "packageIds": [
        "EIP-0005",
        "EIP-0006"
      ],
      "evidenceUrl": "https://github.com/itdojp/white-hat-cyber-intelligence-book/issues/98",
      "reason": "同一Wave labelが異なるPackageを表す。Wave番号で選択しない。"
    }
  ],
  "packages": [
    {
      "packageId": "EIP-0001",
      "filename": "white-hat-book-parallel-drafts-2026-08-08.zip",
      "sha256": "caf8c73aa4e84c99f4062ac7cf85ac56794ad2cbb5d8ec5d9403138753eb6388",
      "packageKind": "draft",
      "waveLabel": "initial",
      "registeredAt": "2026-08-08",
      "registrationUrl": "https://github.com/itdojp/white-hat-cyber-intelligence-book/issues/63",
      "files": [
        {
          "path": "chapter04-assets-boundaries-threat-model.predraft.md",
          "sha256": "c49f0a11ef9e37f1952199d263125aae9df273032e0a996642cfe9899750c358",
          "role": "candidate-input",
          "targets": [
            "chapter-04"
          ]
        },
        {
          "path": "chapter05-attack-behavior.predraft.md",
          "sha256": "11e256480c15771334cc3c9e8eb0933635c305604ba9302482ce627205e1ef12",
          "role": "candidate-input",
          "targets": [
            "chapter-05"
          ]
        },
        {
          "path": "parallel-draft-integration-guide.md",
          "sha256": "18397fbbacce8ef45c986c8ddf3ec73853cb0aed55624fc14c524035cbc301a3",
          "role": "integration-guide",
          "targets": [
            "chapter-04",
            "chapter-05"
          ]
        },
        {
          "path": "source-review-notes.md",
          "sha256": "69342e0bfb2381aaf0876267af4471968f9abaf358110ab1ef5961b9268d2668",
          "role": "source-review",
          "targets": [
            "chapter-04",
            "chapter-05"
          ]
        }
      ]
    },
    {
      "packageId": "EIP-0002",
      "filename": "white-hat-book-parallel-drafts-2026-08-08-wave2.zip",
      "sha256": "fffbd2af8a17cbbfa60c09c37c30a682a9c528b44194e0e9f0f3588e2a6a46ca",
      "packageKind": "draft",
      "waveLabel": "wave-2",
      "registeredAt": "2026-08-08",
      "registrationUrl": "https://github.com/itdojp/white-hat-cyber-intelligence-book/issues/63#issuecomment-5223904155",
      "files": [
        {
          "path": "chapter06-observable-systems.predraft.md",
          "sha256": "2c4e8b2b85086bde3d0f83bb4e2ed61cf0d7512252e27fbc805a272249e8973d",
          "role": "candidate-input",
          "targets": [
            "chapter-06"
          ]
        },
        {
          "path": "chapter23-intelligence-requirements.predraft.md",
          "sha256": "29d20db7f44a073d8aa3b8d1c18db109f479297da79cec787edc5e8b4e5b9493",
          "role": "candidate-input",
          "targets": [
            "chapter-23"
          ]
        },
        {
          "path": "source-review-notes-ch06-ch23.md",
          "sha256": "4219a91991469959cf60e1ba90e0c7b8158620ac8ba336c7fedd86237a5daf69",
          "role": "source-review",
          "targets": [
            "chapter-06",
            "chapter-23"
          ]
        },
        {
          "path": "parallel-draft-integration-guide-wave2.md",
          "sha256": "492cf9d8844a9a577e6c9a5e39ae1a3043a41ffb57613a59e7047470b4162d83",
          "role": "integration-guide",
          "targets": [
            "chapter-06",
            "chapter-23"
          ]
        }
      ]
    },
    {
      "packageId": "EIP-0003",
      "filename": "white-hat-book-parallel-drafts-2026-08-08-wave3.zip",
      "sha256": "d986ee9a9c71cf210420bb921f078a395133e2e5e0b9050960ad63554c22582a",
      "packageKind": "draft",
      "waveLabel": "wave-3",
      "registeredAt": "2026-08-08",
      "registrationUrl": "https://github.com/itdojp/white-hat-cyber-intelligence-book/issues/63#issuecomment-5224086644",
      "files": [
        {
          "path": "chapter07-vulnerability-prioritization.predraft.md",
          "sha256": "6caf4e3d9174ae8b527df5b14301cd456550b1eca1ea7e88cf7c19e5031338cb",
          "role": "candidate-input",
          "targets": [
            "chapter-07"
          ]
        },
        {
          "path": "chapter24-osint-provenance-sources.predraft.md",
          "sha256": "b1b83a6735ac33f66afa27d1ac2ce1f260d70fc904eca9b6b5c2fefb36ed59bd",
          "role": "candidate-input",
          "targets": [
            "chapter-24"
          ]
        },
        {
          "path": "source-review-notes-ch07-ch24.md",
          "sha256": "6367d19c50f2f0a97c26998ed1025e7aeebf9ce3b97460f3f8c768a3003ff793",
          "role": "source-review",
          "targets": [
            "chapter-07",
            "chapter-24"
          ]
        },
        {
          "path": "parallel-draft-integration-guide-wave3.md",
          "sha256": "c0a0fe9b6d680721fcd4c0be903415052933b2702d9466c041dec18a70a5553d",
          "role": "integration-guide",
          "targets": [
            "chapter-07",
            "chapter-24"
          ]
        }
      ]
    },
    {
      "packageId": "EIP-0004",
      "filename": "white-hat-book-parallel-drafts-2026-08-08-wave4.zip",
      "sha256": "956a321088abed3058e59c58ceeda3d5fd57a9d12a6715240185d0d7c445d86f",
      "packageKind": "draft",
      "waveLabel": "wave-4",
      "registeredAt": "2026-08-08",
      "registrationUrl": "https://github.com/itdojp/white-hat-cyber-intelligence-book/issues/63#issuecomment-5224564529",
      "files": [
        {
          "path": "chapter08-safe-lab-evidence.predraft.md",
          "sha256": "eee4bacd1c7be3366e6343a10f5f69a184dffe8a16c662fcabe90f24f543373b",
          "role": "candidate-input",
          "targets": [
            "chapter-08"
          ]
        },
        {
          "path": "chapter26-cti-distribution.predraft.md",
          "sha256": "38a432a5daf5477a3b986f8c19307d89a9565edf2f0d3a25ea9815126bb5bf32",
          "role": "candidate-input",
          "targets": [
            "chapter-26"
          ]
        },
        {
          "path": "source-review-notes-ch08-ch26.md",
          "sha256": "995a24030df650782a41fdf977048ceaa864f0bb48ab0d27faae2fc01e7c4b74",
          "role": "source-review",
          "targets": [
            "chapter-08",
            "chapter-26"
          ]
        },
        {
          "path": "parallel-draft-integration-guide-wave4.md",
          "sha256": "dda7ab1d1b74039e9bb1283259b2d90f608c81047917c7cd4df8979b9364f90b",
          "role": "integration-guide",
          "targets": [
            "chapter-08",
            "chapter-26"
          ]
        }
      ]
    },
    {
      "packageId": "EIP-0005",
      "filename": "white-hat-book-parallel-drafts-2026-08-09-wave5.zip",
      "sha256": "c4fd20d4c44d769c22bbab886535ca3105b3a3a5ed7bdb6cea71619e6b7279a0",
      "packageKind": "draft",
      "waveLabel": "wave-5",
      "registeredAt": "2026-08-09",
      "registrationUrl": "https://github.com/itdojp/white-hat-cyber-intelligence-book/issues/63#issuecomment-5228684652",
      "files": [
        {
          "path": "chapter09-engagement-roe.predraft.md",
          "sha256": "00de5e803e04d13ae80b9960489a2d7d90d6564c88324d7f32aed8c28c96ea91",
          "role": "candidate-input",
          "targets": [
            "chapter-09"
          ]
        },
        {
          "path": "chapter10-recon-osint-boundary.predraft.md",
          "sha256": "23f9af567b80d64c0d191b0f7905ddd8350ce81606d24c72626949fa30739002",
          "role": "candidate-input",
          "targets": [
            "chapter-10"
          ]
        },
        {
          "path": "source-review-notes-ch09-ch10.md",
          "sha256": "ac1988947e7c3a654b2f4778043d735808b7332e588f9712b376909c5975fed2",
          "role": "source-review",
          "targets": [
            "chapter-09",
            "chapter-10"
          ]
        },
        {
          "path": "parallel-draft-integration-guide-wave5.md",
          "sha256": "137c211a0bfb481876af0b13d96e8369325a715a708693e471f5fd9dd522d075",
          "role": "integration-guide",
          "targets": [
            "chapter-09",
            "chapter-10"
          ]
        }
      ]
    },
    {
      "packageId": "EIP-0006",